{
  "$schema": "../schema.json",
  "name": "transforms",
  "description": "Declared pipeline and match transforms composed with portable built-ins.",
  "languageVersion": "2026-07-15",
  "irVersion": "2026-07-15",
  "source": "extractor.kdl",
  "inputs": "inputs.json",
  "expected": { "ir": "expected-ir.json", "output": "expected-output.json" },
  "executions": [
    { "implementation": "go", "mode": "offline-html", "fixture": "page.html" },
    { "implementation": "typescript", "mode": "offline-html", "fixture": "page.html" }
  ],
  "adapters": []
}
